{
  "$schema": "https://json-schema.org/draft/2020-12/schema",
  "title": "Edition",
  "description": "Several checked stories on one page, grouped into sections. Paths are relative to this file.",
  "type": "object",
  "required": ["title", "sections"],
  "additionalProperties": false,
  "properties": {
    "title": {
      "type": "string",
      "minLength": 1,
      "maxLength": 80,
      "description": "The edition's name, at the top of the page and in the browser tab."
    },
    "dek": {
      "type": "string",
      "maxLength": 200,
      "description": "Optional: one sentence under the title."
    },
    "date": {
      "type": "string",
      "maxLength": 40,
      "description": "Optional: the edition's date, written as readers should see it."
    },
    "footer": {
      "type": "string",
      "maxLength": 200,
      "description": "Optional: a closing line at the end of the page."
    },
    "sections": {
      "type": "array",
      "minItems": 1,
      "description": "In reading order. The page opens with a link to each.",
      "items": {
        "type": "object",
        "required": ["id", "title", "stories"],
        "additionalProperties": false,
        "properties": {
          "id": {
            "type": "string",
            "minLength": 1,
            "maxLength": 40,
            "description": "Lowercase letters, digits and hyphens. The section's link target, as in page.html#travel."
          },
          "title": {
            "type": "string",
            "minLength": 1,
            "maxLength": 40
          },
          "icon": {
            "type": "string",
            "maxLength": 8,
            "description": "Optional: an emoji shown before the title."
          },
          "stories": {
            "type": "array",
            "minItems": 1,
            "items": {
              "type": "object",
              "required": ["article", "storyboard"],
              "additionalProperties": false,
              "properties": {
                "article": {"type": "string", "minLength": 1},
                "storyboard": {"type": "string", "minLength": 1}
              }
            }
          }
        }
      }
    }
  }
}
